cboid,cbodesc,cbotrans,iscoid,iscodesc,cbo_currno,isco_currno
"8-11","Marceneiros e trabalhadores assemelhados","","","",2004,
"8-11.10","Marceneiro, em geral","Cabinet makers, general","7422","Cabinet makers and related workers",2005,394
"8-11.30","Folheador de móveis de madeira","Wood veneer painters","7422","Cabinet makers and related workers",2006,394
"8-11.40","Lustrador de peças de madeira","Wood polishers","7422","Cabinet makers and related workers",2007,394
"8-11.90","Outros marceneiros e trabalhadores assemelhados","Other cabinet makers and similar workers","7422","Cabinet makers and related workers",2008,394
"8-12","Operadores de máquinas de lavrar madeira","","","",2009,
"8-12.10","Operador de máquinas de lavrar madeira, em geral","Machinery operators (wood carving and cutting)","8240","Wood-products machine operators",2010,454
"8-12.15","Operador de máquina de tupiar (lavra de madeira)","Machinery operators (wood carving and cutting)","8240","Wood-products machine operators",2011,454
"8-12.20","Operador de serras (lavra de madeira)","Saw operators (wood carving and cutting)","8240","Wood-products machine operators",2012,454
"8-12.30","Torneiro (lavra de madeira)","Wood carvers","8240","Wood-products machine operators",2013,454
"8-12.40","Operador de torno automático (lavra de madeira)","Wood carving operators (lathing)","8240","Wood-products machine operators",2014,454
"8-12.50","Operador de molduradora (lavra de madeira)","Wood carving operators (framing)","8240","Wood-products machine operators",2015,454
"8-12.60","Operador de entalhadeira (lavra de madeira)","Wood carving operators (designing)","8240","Wood-products machine operators",2016,454
"8-12.65","Operador de lixadeira (lavra de madeira)","Wood carving operators (sand paper finishing)","8240","Wood-products machine operators",2017,454
"8-12.70","Operador de plaina (lavra de madeira)","Wood carving operators (slicing)","8240","Wood-products machine operators",2018,454
"8-12.80","Operador de fresadora (lavra de madeira)","Wood carving operators (milling)","8240","Wood-products machine operators",2019,454
"8-12.85","Operador de máquina de lavrar madeira (produção em série)","Wood carving operators (assembly line)","8240","Wood-products machine operators",2020,454
"8-12.90","Outros operadores de máquinas de lavrar madeira","Other wood carving operators","8240","Wood-products machine operators",2021,454
"8-19","Marceneiros, operadores de máquinas de lavrar madeira e trabalhadores assemelhad","","","",2022,
"8-19.30","Tanoeiro","Barrel carvers","7331","Handicraft workers in wood and related materials",2023,375
"8-19.35","Modelador de madeira","Wood designers","7331","Handicraft workers in wood and related materials",2024,375
"8-19.40","Maquetista","Wood model creators","7331","Handicraft workers in wood and related materials",2025,375
"8-19.45","Entalhador","Wood carvers (decoration)","7331","Handicraft workers in wood and related materials",2026,375
"8-19.65","Marcheteiro","Wood carvers (inlay decoration)","7331","Handicraft workers in wood and related materials",2027,375
"8-19.90","Outros marceneiros, operadores de máquinas de lavrar madeira e trabalhadores ass","Other carpenters, wood machine carving operators and similar workers n.e.c.","7331","Handicraft workers in wood and related materials",2028,375
"8-2","CORTADORES, POLIDORES E GRAVADORES DE PEDRAS","","","",2029,
"8-20","Cortadores, polidores e gravadores de pedras","","","",2030,
"8-20.20","Cortador de pedras","Stone cutters","7113","Stone splitters, cutters and carvers",2031,322
"8-20.25","Polidor de pedras","Stone polishers","7113","Stone splitters, cutters and carvers",2032,322
"8-20.40","Traçador de pedras","Stone sketch designers","7113","Stone splitters, cutters and carvers",2033,322
"8-20.50","Torneiro (lavra de pedra)","Stone carvers","7113","Stone splitters, cutters and carvers",2034,322
"8-20.60","Gravador de inscrições em pedra","Stone engravers","7113","Stone splitters, cutters and carvers",2035,322
"8-20.70","Gravador de relevos em pedra","Stone engravers (relief detail)","7113","Stone splitters, cutters and carvers",2036,322
"8-20.90","Outros cortadores, polidores e gravadores de pedras","Other cutters, polishers and stone engravers","7113","Stone splitters, cutters and carvers",2037,322
"8-3","TRABALHADORES DA USINAGEM DE METAIS","","","",2038,
"8-31","Forjadores","","","",2039,
"8-31.10","Forjador, em geral","Furnace operators, general","7211","Metal moulders and coremakers",2040,343
"8-31.30","Forjador a martelo-pilão","Furnace operators (hydraulic hammer)","7211","Metal moulders and coremakers",2041,343
"8-31.40","Forjador prensista","Furnace operators (pressing)","7211","Metal moulders and coremakers",2042,343
"8-31.90","Outros forjadores","Other furnace operators","7211","Metal moulders and coremakers",2043,343
"8-32","Ferramenteiros e modeladores de metais","","","",2044,
"8-32.10","Ferramenteiro, em geral","Tool maintenance workers","7222","Tool-makers and related workers",2045,351
"8-32.15","Ferramenteiro de corte e repuxo","Tool maintenance workers (tool cutting)","7222","Tool-makers and related workers",2046,351
"8-32.30","Ferramenteiro de mandris, calibradores e outros dispositivos","Tool maintenance workers (tool drilling and calibration)","7222","Tool-makers and related workers",2047,351
"8-32.40","Modelador de metal (fundição)","Metal moulders (heating)","7211","Metal moulders and coremakers",2048,343
"8-32.50","Riscador de metais","Metal markers (before cutting)","7211","Metal moulders and coremakers",2049,343
"8-32.90","Outros ferramenteiros e modeladores de metais","Other tool maintenance and metal workers","7222","Tool-makers and related workers",2050,351
"8-33","Torneiros, fresadores, retificadores e trabalhadores assemelhados","","","",2051,
"8-33.08","Operador de máquinas operatrizes, em geral","Metalwork machine operators, general","7224","Metal wheel-grinders, polishers and tool sharpeners",2052,353
"8-33.15","Furador","Drillers","7224","Metal wheel-grinders, polishers and tool sharpeners",2053,353
"8-33.17","Retificador","Metal slicers","7224","Metal wheel-grinders, polishers and tool sharpeners",2054,353
"8-33.19","Retificador de fieiras","Metal slicers (wire)","7224","Metal wheel-grinders, polishers and tool sharpeners",2055,353
"8-33.20","Torneiro mecânico","Turning lathe mechanics","7224","Metal wheel-grinders, polishers and tool sharpeners",2056,353
"8-33.25","Torneiro repuxador","Turning lathe operators","7224","Metal wheel-grinders, polishers and tool sharpeners",2057,353
"8-33.27","Operador de máquina de eletroerosão","Electroerosion equipment operators (metal cutting)","7224","Metal wheel-grinders, polishers and tool sharpeners",2058,353
"8-33.30","Fresador (fresadora universal)","Rotary-grind operators","7224","Metal wheel-grinders, polishers and tool sharpeners",2059,353
"8-33.40","Plainador de metais (plaina limadora)","Metal surface finishers (smooth)","7224","Metal wheel-grinders, polishers and tool sharpeners",2060,353
"8-33.50","Mandrilador","Mandril operators","7224","Metal wheel-grinders, polishers and tool sharpeners",2061,353
"8-33.55","Brunidor de cilindros","Metal polishers (cylinders and mandrils)","7224","Metal wheel-grinders, polishers and tool sharpeners",2062,353
"8-33.60","Furador (furadeira radial)","Radial drillers","7224","Metal wheel-grinders, polishers and tool sharpeners",2063,353
"8-33.65","Broqueador de cilindros","Bore drillers (cylinders)","7224","Metal wheel-grinders, polishers and tool sharpeners",2064,353
"8-33.67","Foscador de cilindros (laminação)","Matte finishers (cylinders)","7224","Metal wheel-grinders, polishers and tool sharpeners",2065,353
"8-33.70","Retificador (retificadora plana)","Metal slicers (smoothing)","7224","Metal wheel-grinders, polishers and tool sharpeners",2066,353
"8-33.75","Retificador (retificadora cilíndrica externa e interna)","Metal slicers (cylinders)","7224","Metal wheel-grinders, polishers and tool sharpeners",2067,353
"8-33.85","Retificador (retificadora de árvore de manivelas)","Metal slicers (gear)","7224","Metal wheel-grinders, polishers and tool sharpeners",2068,353
"8-33.90","Outros torneiros, fresadores, retificadores e trabalhadores assemelhados","Other metalwork, rotary-gring, slicing, and similar workers","7224","Metal wheel-grinders, polishers and tool sharpeners",2069,353
"8-34","Preparadores de máquinas-ferramentas (produção em série)","","","",2070,
"8-34.10","Preparador de máquinas-ferramentas, em geral (produção em série)","Tool and machine maintenance operators, general (assembly-line production)","7223","Machine-tool setters and setter-operators",2071,352
"8-34.15","Preparador de prensa mecânica de metais (produção em série)","Mechanical metal press processors (assembly-line production)","7223","Machine-tool setters and setter-operators",2072,352
"8-34.17","Preparador de ferramentas para máquinas-ferramentas com comando numérico","Tool and machine maintenance operators","7223","Machine-tool setters and setter-operators",2073,352
"8-34.20","Preparador de torno automático (produção em série)","Automatic turning lathe preparers (assembly-line production)","7223","Machine-tool setters and setter-operators",2074,352
"8-34.25","Preparador de torno-revólver (produção em série)","Automatic turning lathe preparers (assembly-line production)","7223","Machine-tool setters and setter-operators",2075,352
"8-34.27","Preparador de torno copiador (produção em série)","Copying turning lathe preparers (assembly-line production)","7223","Machine-tool setters and setter-operators",2076,352
"8-34.35","Preparador de fresadora copiadora (produção em série)","Copying mill preparers (assembly-line production)","7223","Machine-tool setters and setter-operators",2077,352
"8-34.37","Preparador de fresadora de engrenagens (produção em série)","Gear mill preparers (assembly-line production)","7223","Machine-tool setters and setter-operators",2078,352
"8-34.45","Preparador de furadeira (produção em série)","Drilling machine preparers (assembly-line production)","7223","Machine-tool setters and setter-operators",2079,352
"8-34.65","Preparador de retificadora sem centro (produção em série)","Straightening machine preparers (assembly-line production)","7223","Machine-tool setters and setter-operators",2080,352
"8-34.80","Preparador de máquina de transferência (produção em série)","Transfer machinery preparers (assembly-line production)","7223","Machine-tool setters and setter-operators",2081,352
"8-34.85","Preparador de máquina de tarraxar (produção em série)","Screwing machinery preparers (assembly-line production)","7223","Machine-tool setters and setter-operators",2082,352
"8-34.90","Outros preparadores de máquinas-ferramentas (produção em série)","Other tool and machine preparers (assembly-line production)","7223","Machine-tool setters and setter-operators",2083,352
"8-35","Operadores de máquinas-ferramentas (produção em série)","","","",2084,
"8-35.10","Operador de máquinas-ferramentas, em geral (produção em série)","Tool and machine operators, general (assembly-line production)","8211","Machine-tool operators",2085,442
"8-35.15","Operador de prensa mecânica de metais (produção em série)","Mechanical metal press operators (assembly-line production)","8211","Machine-tool operators",2086,442
"8-35.20","Operador de torno automático (produção em série)","Automatic turning lathe operators (assembly-line production)","8211","Machine-tool operators",2087,442
"8-35.25","Operador de torno-revólver (produção em série)","Automatic revolving lathe operators (assembly-line production)","8211","Machine-tool operators",2088,442
"8-35.30","Operador de torno copiador (produção em série)","Copying turning lathe machine operators (assembly-line production)","8211","Machine-tool operators",2089,442
"8-35.35","Operador de fresadora copiadora (produção em série)","Copying mill operators (assembly-line production)","8211","Machine-tool operators",2090,442
"8-35.40","Operador de fresadora de engrenagens (produção em série)","Gear mill operators (assembly-line production)","8211","Machine-tool operators",2091,442
"8-35.45","Operador de furadeira (produção em série)","Drilling machine operators (assembly-line production)","8211","Machine-tool operators",2092,442
"8-35.50","Operador de retificadora sem centro (produção em série)","Straightening machine operators (assembly-line production)","8211","Machine-tool operators",2093,442
"8-35.55","Operador de serra de metais (produção em série)","Metal saw operators (assembly-line production)","8211","Machine-tool operators",2094,442
"8-35.60","Operador de máquina de transferência (produção em série)","Transfer machinery operators (assembly-line production)","8211","Machine-tool operators",2095,442
"8-35.65","Operador de máquina de tarraxar (produção em série)","Screwing machinery operators (assembly-line production)","8211","Machine-tool operators",2096,442
"8-35.90","Outros operadores de máquinas-ferramentas (produção em série)","Other tool and machine operators (assembly-line production)","8211","Machine-tool operators",2097,442
"8-36","Polidores de metais e afiadores de ferramentas","","","",2098,
"8-36.20","Polidor de metais","Metal polishers","7224","Metal wheel-grinders, polishers and tool sharpeners",2099,353
"8-36.30","Afiador de ferramentas","Tool sharpeners","7224","Metal wheel-grinders, polishers and tool sharpeners",2100,353
"8-36.40","Afiador de cutelaria","Knife sharpeners","7224","Metal wheel-grinders, polishers and tool sharpeners",2101,353
"8-36.50","Afiador de serras","Saw sharpeners","7224","Metal wheel-grinders, polishers and tool sharpeners",2102,353
"8-36.60","Afiador de cardas","Drill sharpeners","7224","Metal wheel-grinders, polishers and tool sharpeners",2103,353
"8-36.90","Outros polidores de metais e afiadores de ferramentas","Other metal polishers and tool sharpeners","7224","Metal wheel-grinders, polishers and tool sharpeners",2104,353
"8-37","Operadores de máquinas-ferramentas com comando numérico","","","",2105,
"8-37.15","Operador de furadeira com comando numérico","Computer numeric control drilling machine operators","8172","Industrial-robot operators",2106,439
"8-37.17","Operador de retificadora com comado numérico","Computer numeric control straightening machine operators","8172","Industrial-robot operators",2107,439
"8-37.20","Operador de torno com comando numérico","Computer numeric control turning lathe operators","8172","Industrial-robot operators",2108,439
"8-37.27","Operador de máquina de eletroerosão a fio com comando numérico","Computer numeric control electroerosion equipment operators","8172","Industrial-robot operators",2109,439
"8-37.30","Operador de fresadora com comando numérico","Computer numeric control milling machine operators","8172","Industrial-robot operators",2110,439
"8-37.50","Operador de mandriladora com comando numérico","Computer numeric control mandril operators","8172","Industrial-robot operators",2111,439
"8-37.60","Operador de centro de usinagem com comando numérico","Computer numeric control industrial machine operators","8172","Industrial-robot operators",2112,439
"8-37.90","Outros operadores de máquinas-ferramentas com comando numérico","Other computer numeric control tool and machine operators","8172","Industrial-robot operators",2113,439
"8-39","Trabalhadores da usinagem de metais não-classificados sob outras epígrafes","","","",2114,
"8-39.15","Serralheiro","Blacksmiths","7221","Blacksmiths, hammer-smiths and forging-press workers",2115,350
"8-39.80","Operador de tesoura mecânica e máquina de corte","Mechanical cutter and cutting machine operators","8211","Machine-tool operators",2116,442
"8-39.90","Outros trabalhadores da usinagem de metais não-classificados sob outras epígrafe","Other metal processing workers","7221","Blacksmiths, hammer-smiths and forging-press workers",2117,350
"8-4","AJUSTADORES MECÂNICOS, MONTADORES E MECÂNICOS DE MÁQUINAS, VEÍCULOS E INSTRUMENT","","","",2118,
"8-40","Ajustadores mecânicos","","","",2119,
"8-40.10","Ajustador mecânico, em geral","Mechanical adjusters, general","7223","Machine-tool setters and setter-operators",2120,352
"8-40.20","Ajustador mecânico (usinagem em bancada e em máquinas-ferramentas)","Mechanical adjusters (small parts processing on workbenches)","7223","Machine-tool setters and setter-operators",2121,352
"8-40.30","Ajustador mecânico em bancada","Mechanical adjusters (small parts)","7223","Machine-tool setters and setter-operators",2122,352
"8-40.90","Outros ajustadores mecânicos","Other mechanical adjusters","7223","Machine-tool setters and setter-operators",2123,352
"8-41","Montadores de máquinas","","","",2124,
"8-41.10","Montador de máquinas, em geral","Machine assemblers, general","8281","Mechanical-machinery assemblers",2125,478
"8-41.13","Montador de equipamento de levantamento","Lift device assemblers","8281","Mechanical-machinery assemblers",2126,478
"8-41.15","Montador de motores de explosão e diesel","Internal combustion and diesel engine assemblers","8281","Mechanical-machinery assemblers",2127,478
"8-41.20","Montador de motores de aeronaves","Aircraft engine assemblers","8281","Mechanical-machinery assemblers",2128,478
"8-41.25","Montador de motores de embarcações","Naval engine assemblers","8281","Mechanical-machinery assemblers",2129,478
"8-41.30","Montador de turbinas (exceto turbinas de aeronaves e de embarcações)","Turbine engine assemblers (except aircraft and boat turbines)","8281","Mechanical-machinery assemblers",2130,478
"8-41.35","Montador de máquinas-ferramentas (usinagem de metais)","Machine tool assemblers (metal factory)","8281","Mechanical-machinery assemblers",2131,478
"8-41.40","Montador de máquinas de minas e pedreiras","Machine assemblers (mining and quarrying)","8281","Mechanical-machinery assemblers",2132,478
"8-41.45","Montador de máquinas gráficas","Machine assemblers (printing)","8281","Mechanical-machinery assemblers",2133,478
"8-41.50","Montador de máquinas têxteis","Machine assemblers (textiles)","8281","Mechanical-machinery assemblers",2134,478
"8-41.55","Montador de máquinas operatrizes para madeira","Machine assemblers (wood processing)","8281","Mechanical-machinery assemblers",2135,478
"8-41.60","Montador de máquinas agrícolas","Machine assemblers (agriculture)","8281","Mechanical-machinery assemblers",2136,478
"8-41.65","Montador de máquinas de terraplenagem","Machine assemblers (earth-moving equipment)","8281","Mechanical-machinery assemblers",2137,478
"8-41.70","Montador de máquinas de escritório","Machine assemblers (office machinery)","8290","Other machine operators and assemblers",2138,485
"8-41.80","Montador de instalações de calefação, ventilação e refrigeração","Machine assemblers (insulation, ventilation, and refrigeration)","8290","Other machine operators and assemblers",2139,485
"8-41.85","Montador de estruturas de aeronaves","Aircraft structure assemblers","8290","Other machine operators and assemblers",2140,485
"8-41.87","Montador de sistemas de combustível de aeronaves","Aircraft fuel system assemblers","8290","Other machine operators and assemblers",2141,485
"8-41.90","Outros montadores de máquinas","Other machine assemblers","8290","Other machine operators and assemblers",2142,485
"8-42","Relojoeiros e montadores de instrumentos de precisão","","","",2143,
"8-42.20","Relojoeiro (fabricação)","Clock and watch makers","7311","Precision-instrument makers and repairers",2144,366
"8-42.25","Relojoeiro (reparação)","Clock and watch repairers","7311","Precision-instrument makers and repairers",2145,366
"8-42.30","Ajustador de instrumentos de precisão","Precision instrument adjusters","7311","Precision-instrument makers and repairers",2146,366
"8-42.35","Montador de instrumentos de óptica","Optical instrument assemblers","7311","Precision-instrument makers and repairers",2147,366
"8-42.40","Montador de instrumentos de precisão","Precision instrument assemblers","7311","Precision-instrument makers and repairers",2148,366
"8-42.45","Ajustador de aparelhos ortopédicos","Orthopedic device adjusters","7311","Precision-instrument makers and repairers",2149,366
"8-42.50","Protético dentário","Dental prosthetics specialists","7311","Precision-instrument makers and repairers",2150,366
"8-42.60","Montador de balanças","Scales assemblers","7311","Precision-instrument makers and repairers",2151,366
"8-42.70","Montador de taxímetros","Taximeter assemblers","7311","Precision-instrument makers and repairers",2152,366
"8-42.90","Outros relojoeiros e montadores de instrumentos de precisão","Other clock, watch and precision instrument makers","7311","Precision-instrument makers and repairers",2153,366
"8-43","Mecânicos de manutenção de veículos automotores","","","",2154,
"8-43.20","Mecânico de manutenção de automóveis, motocicletas e veículos similares","Car, motorcycle, and other vehicle maintenance mechanics","7231","Motor vehicle mechanics and fitters",2155,355
"8-43.40","Mecânico de manutenção de motocicletas","Motorcycle maintenance mechanics","7231","Motor vehicle mechanics and fitters",2156,355
"8-43.50","Mecânico de manutenção de veículos automotores a diesel (exceto tratores)","Diesel vehicle maintenance mechanics (except tractors)","7231","Motor vehicle mechanics and fitters",2157,355
"8-43.60","Mecânico de manutenção de tratores","Tractor maintenance mechanics","7231","Motor vehicle mechanics and fitters",2158,355
"8-43.90","Outros mecânicos de manutenção de veículos automotores","Other maintenance mechanics","7231","Motor vehicle mechanics and fitters",2159,355
"8-44","Mecânicos de manutenção de aeronaves","","","",2160,
"8-44.10","Mecânico de manutenção de aeronaves, em geral","Aircraft maintenance mechanics, general","7232","Aircraft engine mechanics and fitters",2161,356
"8-44.25","Mecânico de manutenção de aeronaves (serviço de pista)","Aircraft maintenance mechanics (runway service)","7232","Aircraft engine mechanics and fitters",2162,356
"8-44.30","Mecânico de manutenção do sistema hidráulico de aeronaves (serviço de pista e ha","Aircraft hydraulics maintenance mechanics (hangar and runway service)","7232","Aircraft engine mechanics and fitters",2163,356
"8-44.40","Mecânico de manutenção do sistema hidráulico de aeronaves (oficina)","Aircraft hydraulics maintenance mechanics (repair shop)","7232","Aircraft engine mechanics and fitters",2164,356
"8-44.90","Outros mecânicos de manutenção de aeronaves","Other aircraft maintenance mechanics","7232","Aircraft engine mechanics and fitters",2165,356
"8-45","Mecânicos de manutenção de máquinas","","","",2166,
"8-45.10","Mecânico de manutenção de máquinas, em geral","Machine maintenance mechanics, general","7233","Agricultural- or industrial-machinery mechanics and fitters",2167,357
"8-45.15","Mecânico de manutenção de máquinas a vapor de movimento alternativo","Steam engine maintenance mechanics","7233","Agricultural- or industrial-machinery mechanics and fitters",2168,357
"8-45.20","Mecânico de manutenção de motores diesel (exceto de veículos automotores)","Diesel engine maintenance mechanics (except automotive vehicles)","7233","Agricultural- or industrial-machinery mechanics and fitters",2169,357
"8-45.25","Mecânico de manutenção de turbinas (exceto de aeronaves e de embarcações)","Turbine maintenance mechanics (except aircraft and boat turbines)","7233","Agricultural- or industrial-machinery mechanics and fitters",2170,357
"8-45.30","Mecânico de manutenção de máquinas-ferramentas (usinagem de metais)","Tool machine maintenance mechanics (metal factory)","7233","Agricultural- or industrial-machinery mechanics and fitters",2171,357
"8-45.35","Mecânico de manutenção de equipamento de mineração","Machine maintenance mechanics (mining and quarrying)","7233","Agricultural- or industrial-machinery mechanics and fitters",2172,357
"8-45.40","Mecânico de manutenção de máquinas gráficas","Machine maintenance mechanics (graphics)","7233","Agricultural- or industrial-machinery mechanics and fitters",2173,357
"8-45.45","Mecânico de manutenção de máquinas têxteis","Machine maintenance mechanics (textiles)","7233","Agricultural- or industrial-machinery mechanics and fitters",2174,357
"8-45.50","Mecânico de manutenção de máquinas operatrizes (lavra de madeira)","Machine maintenance mechanics (wood processing)","7233","Agricultural- or industrial-machinery mechanics and fitters",2175,357
"8-45.55","Mecânico de manutenção de máquinas agrícolas","Machine maintenance mechanics (agriculture)","7233","Agricultural- or industrial-machinery mechanics and fitters",2176,357
"8-45.60","Mecânico de manutenção de máquinas de construção e terraplenagem","Machine maintenance mechanics (landmovers)","7233","Agricultural- or industrial-machinery mechanics and fitters",2177,357
"8-45.65","Mecânico de manutenção de máquinas de escritório","Machine maintenance mechanics (office machinery)","7233","Agricultural- or industrial-machinery mechanics and fitters",2178,357
"8-45.70","Mecânico de manutenção de instalações mecânicas de edifícios","Machine maintenance mechanics (building installations)","7233","Agricultural- or industrial-machinery mechanics and fitters",2179,357
"8-45.75","Mecânico de manutenção de aparelhos de levantamento","Machine maintenance mechanics (lifts)","7233","Agricultural- or industrial-machinery mechanics and fitters",2180,357
