cboid,cbodesc,cbotrans,iscoid,iscodesc,cbo_currno,isco_currno
"2-39.90","Outros diretores de empresas não-classificados sob outras epígrafes","Other directors of enterprises n.e.c.","1319","General managers not elsewhere classified",802,45
"2-4","GERENTES DE EMPRESAS","","","",803,
"2-41","Gerentes administrativos e assemelhados","","","",804,
"2-41.20","Gerente administrativo","Administrative managers","1231","Finance and administration department managers",805,27
"2-41.25","Gerente executivo","Executive managers","1231","Finance and administration department managers",806,27
"2-41.30","Gerente de pessoal","Personnel managers","1232","Personnel and industrial relations department managers",807,28
"2-41.40","Gerente de relações públicas","Public relations managers","1234","Advertising and public relations department managers",808,30
"2-41.50","Gerente de recrutamento, seleção e treinamento","Recruitment, selection and training managers","1232","Personnel and industrial relations department managers",809,28
"2-41.90","Outros gerentes administrativos e assemelhados","Other administrative and similar managers","1239","Other department managers not elsewhere classified",810,34
"2-42","Gerentes de produção, de planejamento e de pesquisa e desenvolvimento","","","",811,
"2-42.20","Gerente de produção","Production managers","1229","Production and operations department managers not elsewhere classified",812,25
"2-42.30","Gerente de pesquisa e desenvolvimento","Research and development department managers","1237","Research and development department managers",813,33
"2-42.40","Gerente de planejamento","Planning managers","1229","Production and operations department managers not elsewhere classified",814,25
"2-42.90","Outros gerentes de produção, de planejamento e de pesquisa e desenvolvimento","Other production, planning and research and development department managers","1229","Production and operations department managers not elsewhere classified",815,25
"2-43","Gerentes financeiros, comerciais, marketing e publicidade","","","",816,
"2-43.20","Gerente financeiro","Financial managers","1231","Finance and administration department managers",817,27
"2-43.25","Gerente de banco (agência)","Bank managers","1227","Production and operations department managers in business services",818,23
"2-43.30","Gerente comercial","Commercial managers","1224","Production and operations department managers in wholesale and retail trade",819,20
"2-43.35","Gerente de crédito","Credit managers","1231","Finance and administration department managers",820,27
"2-43.40","Gerente de compras","Purchase managers","1235","Supply and distribution department managers",821,31
"2-43.45","Gerente de sinistro","Insurance claim managers","1231","Finance and administration department managers",822,27
"2-43.47","Gerente de câmbio","Exchange managers","1231","Finance and administration department managers",823,27
"2-43.50","Gerente de vendas","Sales managers","1233","Sales and marketing department managers",824,29
"2-43.55","Gerente de produtos (financeiro)","Product managers (financial)","1227","Production and operations department managers in business services",825,23
"2-43.60","Gerente de propaganda","Advertising managers","1234","Advertising and public relations department managers",826,30
"2-43.65","Gerente de administração de carteiras","Portfolio managers","1231","Finance and administration department managers",827,27
"2-43.70","Gerente de marketing","Marketing managers","1233","Sales and marketing department managers",828,29
"2-43.90","Outros gerentes financeiros, comerciais, marketing e publicidade","Other financial, commercial, marketing and publicity managers","1239","Other department managers not elsewhere classified",829,34
"2-49","Gerentes de empresas não-classificados sob outras epígrafes","","","",830,
"2-49.10","Gerente de operação","Operations managers","1227","Production and operations department managers in business services",831,23
"2-49.20","Gerente de operação de serviços de transporte","Services and transportation managers","1226","Production and operations department managers in transport, storage and communic",832,22
"2-49.30","Gerente de operação de serviços postais e de telecomunicações","Operational managers in postal services and telecommunications","1226","Production and operations department managers in transport, storage and communic",833,22
"2-49.40","Gerente de processamento operacional","Processing operation managers","1227","Production and operations department managers in business services",834,23
"2-49.90","Outros gerentes de empresas não-classificados sob outras epígrafes","Other enterprise managers n.e.c.","1229","Production and operations department managers not elsewhere classified",835,25
"3-0","CHEFES INTERMEDIÁRIOS ADMINISTRATIVOS, DE CONTABILIDADE E FINANÇAS","","","",836,
"3-01","Chefes intermediários administrativos","","","",837,
"3-01.10","Chefe de escritório, em geral","Office supervisors","1239","Other department managers not elsewhere classified",838,34
"3-01.20","Chefe de escritório (pessoal)","Office supervisors (personnel)","1232","Personnel and industrial relations department managers",839,28
"3-01.30","Chefe de escritório (serviços gerais)","Office supervisors (general services)","1239","Other department managers not elsewhere classified",840,34
"3-01.35","Chefe de contas a pagar","Supervisors of bill payments offices","1231","Finance and administration department managers",841,27
"3-01.90","Outros chefes intermediários administrativos","Other office supervisors","1239","Other department managers not elsewhere classified",842,34
"3-02","Chefes intermediários de contabilidade e finanças","","","",843,
"3-02.20","Chefe de escritório (contabilidade)","Office supervisors (accountancy)","1231","Finance and administration department managers",844,27
"3-02.30","Chefe de escritório (orçamento)","Office supervisors (budget)","1231","Finance and administration department managers",845,27
"3-02.40","Chefe de escritório (crédito e cobrança)","Office supervisors (credit and credit collection)","1231","Finance and administration department managers",846,27
"3-02.50","Chefe de escritório (câmbio)","Office supervisors (exchange)","1231","Finance and administration department managers",847,27
"3-02.60","Chefe de escritório (tesouraria)","Office supervisors (treasury)","1231","Finance and administration department managers",848,27
"3-02.90","Outros chefes intermediários de contabilidade e finanças","Other intermediaries, accountancy and finance office supervisors","1231","Finance and administration department managers",849,27
"3-09","Chefes intermediários administrativos, de contabilidade e finanças não-classific","","","",850,
"3-09.20","Chefe de almoxarifado","Storeroom supervisors","1235","Supply and distribution department managers",851,31
"3-09.30","Chefe de controle de patrimônio","Asset management supervisors","1231","Finance and administration department managers",852,27
"3-09.90","Outros chefes intermediários administrativos, de contabilidade e finanças não-cl","Other intermediaries, administrative, accountancy and finance managers n.e.c.","1239","Other department managers not elsewhere classified",853,34
"3-1","AGENTES DE ADMINISTRAÇÃO DE EMPRESAS PÚBLICAS E PRIVADAS","","","",854,
"3-11","Agentes administrativos, assistentes administrativos e trabalhadores assemelhado","","","",855,
"3-11.20","Agente administrativo","Administrative agents","3431","Administrative secretaries and related associate professionals",856,200
"3-11.25","Assistente administrativo","Administrative assistants","3439","Administrative associate professionals not elsewhere classified",857,204
"3-11.90","Outros agentes administrativos, assistentes administrativos e trabalhadores asse","Other administrative agents, administrative assistants and related workers","3439","Administrative associate professionals not elsewhere classified",858,204
"3-12","Técnicos e fiscais de tributação e arrecadação","","","",859,
"3-12.20","Técnico de tributos","Tax assessors","3442","Government tax and excise officials",860,207
"3-12.30","Controlador de arrecadação","Tax collection agents","3442","Government tax and excise officials",861,207
"3-12.40","Fiscal de tributos da fazenda pública","Public tax officials","3442","Government tax and excise officials",862,207
"3-12.50","Fiscal de tributos do açúcar e do álcool","Sugar and alcohol tax officials","3442","Government tax and excise officials",863,207
"3-12.60","Fiscal de contribuições providenciarias","Social security contributions tax officials","3443","Government social benefits officials",864,208
"3-12.90","Outros técnicos e fiscais de tributação e arrecadação","Other tax officials","3442","Government tax and excise officials",865,207
"3-13","Agentes superiores de polícia","","","",866,
"3-13.20","Delegado de polícia","Police chiefs","3450","Police inspectors and detectives",867,212
"3-13.30","Inspetor de polícia","Police inspectors","3450","Police inspectors and detectives",868,212
"3-13.40","Perito criminal","Criminal investigators","3450","Police inspectors and detectives",869,212
"3-13.90","Outros agentes superiores de polícia","Other senior police agents","3450","Police inspectors and detectives",870,212
"3-14","Serventuários da justiça e trabalhadores assemelhados","","","",871,
"3-14.20","Tabelião","Notaries public","3432","Legal and related business associate professionals",872,201
"3-14.30","Escrivão","Recorders","3432","Legal and related business associate professionals",873,201
"3-14.40","Oficial de justiça","Justice officials","3432","Legal and related business associate professionals",874,201
"3-14.90","Outros serventuários da justiça e trabalhadores assemelhados","Other justice servants and related workers","3432","Legal and related business associate professionals",875,201
"3-19","Agentes de administração de empresas públicas e privadas não-classificados sob o","","","",876,
"3-19.20","Agente de saúde pública","Public health agents","3449","Customs, tax and related government associate professionals not elsewhere classi",877,210
"3-19.30","Agente de defesa florestal","Forestry defense agents","3449","Customs, tax and related government associate professionals not elsewhere classi",878,210
"3-19.40","Agente de inspeção da pesca","Fishery inspection agents","3449","Customs, tax and related government associate professionals not elsewhere classi",879,210
"3-19.50","Metrologista","Metrologists","3449","Customs, tax and related government associate professionals not elsewhere classi",880,210
"3-19.60","Técnico de censura","Census agents","3444","Government licensing officials",881,209
"3-19.70","Agente sindical","Union agents","3423","Employment agents and labour contractors",882,197
"3-19.80","Agente de inspeção do trabalho","Workplace inspection agents","3152","Safety, health and quality inspectors",883,153
"3-19.85","Agente de colocação","Placement agents","3423","Employment agents and labour contractors",884,197
"3-19.90","Outros agentes de administração de empresas públicas e privadas não-classificado","Other public and private business administration agents n.e.c.","3439","Administrative associate professionals not elsewhere classified",885,204
"3-2","SECRETÁRIOS, DATILÓGRAFOS, ESTENÓGRAFOS E TRABALHADORES ASSEMELHADOS","","","",886,
"3-21","Secretários","","","",887,
"3-21.05","Secretário, em geral","Secretaries, general","4115","Secretaries",888,230
"3-21.10","Secretário executivo","Executive secretaries","4115","Secretaries",889,230
"3-21.15","Secretário bilíngüe","Bilingual secretaries","4115","Secretaries",890,230
"3-21.90","Outros secretários","Other secretaries","4115","Secretaries",891,230
"3-23","Datilógrafos, estenógrafos e trabalhadores assemelhados","","","",892,
"3-23.20","Datilógrafo","Stenographers","4111","Stenographers and typists",893,226
"3-23.30","Estenógrafo","Stenographers","4111","Stenographers and typists",894,226
"3-23.40","Operador de teleimpressor","Teleprinter operators","4112","Word-processor and related operators",895,227
"3-23.50","Operador de rede de teleprocessamento","Teleprocessor network operators","4112","Word-processor and related operators",896,227
"3-23.90","Outros datilógrafos, estenógrafos e trabalhadores assemelhados","Other stenographers and related workers","4144","Scribes and related workers",897,242
"3-3","TRABALHADORES DE SERVIÇOS DE CONTABILIDADE, CAIXAS E TRABALHADORES ASSEMELHADOS","","","",898,
"3-31","Auxiliares de contabilidade, caixas e trabalhadores assemelhados","","","",899,
"3-31.15","Auxiliar de contabilidade","Accounting assistants","4121","Accounting and bookkeeping clerks",900,232
"3-31.30","Caixa","Cashiers","4211","Cashiers and ticket clerks",901,247
"3-31.40","Caixa de banco","Bank cashiers","4212","Tellers and other counter clerks",902,248
"3-31.45","Operador de caixa","Cashier operators","4212","Tellers and other counter clerks",903,248
"3-31.50","Operador de câmbio","Exchange operators","4212","Tellers and other counter clerks",904,248
"3-31.55","Operador de produtos (financeiros)","Product operators (financial)","4122","Statistical and finance clerks",905,233
"3-31.57","Tesoureiro (banco)","Treasurers (bank)","4121","Accounting and bookkeeping clerks",906,232
"3-31.65","Compensador de banco","Bank compensators","4122","Statistical and finance clerks",907,233
"3-31.75","Encarregado de pagamento","Payment administrators","4121","Accounting and bookkeeping clerks",908,232
"3-31.90","Outros auxiliares de contabilidade, caixas e trabalhadores assemelhados","Other accounting assistants, cashiers and related workers","4190","Other office clerks",909,244
"3-32","Atendentes de guichê, bilheteiros e trabalhadores assemelhados","","","",910,
"3-32.20","Atendente de guichê (agência postal)","Counter attendants (postal agency)","4211","Cashiers and ticket clerks",911,247
"3-32.30","Bilheteiro (locais de diversão)","Ticket clerks (leisure)","4211","Cashiers and ticket clerks",912,247
"3-32.35","Bilheteiro (estações de metrô, ferroviárias e assemelhadas)","Ticket clerks (subway, railways, related)","4211","Cashiers and ticket clerks",913,247
"3-32.40","Emissor de passagens","Tickets issuers","4221","Travel agency and related clerks",914,253
"3-32.50","Recebedor de apostas (turfe)","Bookmakers (betting offices)","4213","Bookmakers and croupiers",915,249
"3-32.60","Recebedor de apostas (loterias)","Bookmakers (lotteries)","4213","Bookmakers and croupiers",916,249
"3-32.70","Distribuidor (coletor de fichas telefônicas)","Distributors (token collector)","9153","Vending-machine money collectors, meter readers and related workers",917,520
"3-32.90","Outros atendentes de guichê, bilheteiros e trabalhadores assemelhados","Other counter attendants, ticket clerks and related workers","4211","Cashiers and ticket clerks",918,247
"3-39","Trabalhadores de serviços de contabilidade, caixas e trabalhadores assemelhados ","","","",919,
"3-39.20","Calculista de custos","Cost accountants","4121","Accounting and bookkeeping clerks",920,232
"3-39.25","Analista de crédito e cobrança","Credit and collection analysts","4215","Debt-collectors and related workers",921,251
"3-39.30","Calculista (folha de pagamento)","Payroll administrators","4121","Accounting and bookkeeping clerks",922,232
"3-39.50","Faturista","Billing assistants","4121","Accounting and bookkeeping clerks",923,232
"3-39.60","Cobrador","Collectors","4215","Debt-collectors and related workers",924,251
"3-39.70","Auxiliar de seguros","Insurance assistants","4122","Statistical and finance clerks",925,233
"3-39.90","Outros trabalhadores de serviços de contabilidade, caixas e trabalhadores asseme","Other accounting services workers, cashiers and related workers n.e.c.","4190","Other office clerks",926,244
"3-4","OPERADORES DE MÁQUINAS CONTÁBEIS, DE CALCULAR E DE PROCESSAMENTO AUTOMÁTICO DE D","","","",927,
"3-41","Operadores de máquinas contábeis e de calcular","","","",928,
"3-41.20","Operador de máquina contábil","Accounting equipment operators","4114","Calculating-machine operators",929,229
"3-41.30","Operador de máquina de calcular","Calculator operators","4114","Calculating-machine operators",930,229
"3-41.90","Outros operadores de máquinas contábeis e de calcular","Other accounting machine and calculator operators","4114","Calculating-machine operators",931,229
"3-42","Operadores de máquinas de processamento automático de dados","","","",932,
"3-42.20","Operador de computador","Mainframe operators","3122","Computer equipment operators",933,138
"3-42.25","Operador de micro","Microcomputer operators","3122","Computer equipment operators",934,138
"3-42.30","Operador de máquinas classificadora e tabuladora","Classification equipment operators","4112","Word-processor and related operators",935,227
"3-42.32","Operador de console","Console operators","4112","Word-processor and related operators",936,227
"3-42.35","Operador de periférico","Peripheral operators","3122","Computer equipment operators",937,138
"3-42.40","Digitador","Typists","4112","Word-processor and related operators",938,227
"3-42.90","Outros operadores de máquinas de processamento automático de dados","Other data processor operators","4112","Word-processor and related operators",939,227
"3-43","Perfuradores e conferidores (cartões e fitas)","","","",940,
"3-43.20","Operador de equipamento de entrada de dados","Data entry operators","4113","Data entry operators",941,228
"3-43.30","Conferidor (cartões e fitas)","Checking workers","4113","Data entry operators",942,228
"3-43.90","Outros perfuradores e conferidores (cartões e fitas)","Other punchers and checkers","4113","Data entry operators",943,228
"3-44","Técnicos de controle de produção e operação","","","",944,
"3-44.10","Encarregado de digitação e operação","Data entry supervisors","4113","Data entry operators",945,228
"3-44.15","Controlador E/S","I/O controllers","4113","Data entry operators",946,228
"3-44.20","Planejista","Planners","4132","Production clerks",947,236
"3-44.30","Scheduller","Schedulers","4132","Production clerks",948,236
"3-44.40","Gerente de operação (informática)","Operations managers (computing)","1236","Computing services department managers",949,32
"3-44.90","Outros técnicos de controle de produção e operação e trabalhadores assemelhados","Other production controller and operations technicians and related workers","4132","Production clerks",950,236
"3-5","CHEFES DE SERVIÇOS DE TRANSPORTES E COMUNICAÇÕES","","","",951,
"3-51","Agentes de estação e de movimento (serviços ferroviários)","","","",952,
"3-51.20","Agente de estação (ferrovias)","Station agents (railway)","1226","Production and operations department managers in transport, storage and communic",953,22
"3-51.30","Agente de movimento (ferrovias)","Movement agents (railway)","5112","Transport conductors",954,260
"3-51.40","Agente de trem","Train agents","5112","Transport conductors",955,260
"3-51.90","Outros agentes de estação e de movimento (serviços ferroviários)","Other stations and movement agents (railway services)","5112","Transport conductors",956,260
"3-52","Chefes de serviços de correios e telecomunicações","","","",957,
"3-52.20","Chefe de serviços postais e telegráficos","Postal services and telegraphic managers","1226","Production and operations department managers in transport, storage and communic",958,22
"3-52.30","Chefe de agência de correios e telégrafos","Postal services and telegraphic agency managers","1226","Production and operations department managers in transport, storage and communic",959,22
"3-52.40","Chefe de serviços de telecomunicações","Telecommunications services managers","1226","Production and operations department managers in transport, storage and communic",960,22
"3-52.90","Outros chefes de serviços de correios e telecomunicações","Other postal and telecommunications services managers","1226","Production and operations department managers in transport, storage and communic",961,22
"3-53","Chefes de serviços aéreos, controladores de tráfego aéreo e trabalhadores asseme","","","",962,
"3-53.20","Gerente de aeroporto","Airport managers","1319","General managers not elsewhere classified",963,45
"3-53.30","Supervisor de vôo","Flight supervisors","3143","Aircraft pilots and related associate professionals",964,148
"3-53.40","Controlador de tráfego aéreo","Air traffic controllers","3144","Air traffic controllers",965,149
"3-53.50","Agente fiscal de aviação civil","Civil aviation fiscal agents","3145","Air traffic safety technicians",966,150
"3-53.90","Outros chefes de serviços aéreos, controladores de tráfego aéreo e trabalhadores","Other air services managers, traffic controllers and related workers","3144","Air traffic controllers",967,149
"3-54","Chefes e inspetores de serviços de transporte rodoviário","","","",968,
"3-54.20","Chefe de serviço de transporte rodoviário (passageiros e cargas)","Road transportation services managers","1226","Production and operations department managers in transport, storage and communic",969,22
"3-54.30","Inspetor de serviços de transporte rodoviário (passageiros e cargas)","Road transportation services inspectors","3152","Safety, health and quality inspectors",970,153
"3-54.90","Outros chefes e inspetores de serviços de transporte rodoviário","Other managers and inspectors of road transportation","1226","Production and operations department managers in transport, storage and communic",971,22
"3-55","Chefes de serviços de transporte marítimo, fluvial e lacustre","","","",972,
"3-55.20","Chefe de serviços de transporte por vias navegáveis","Sea transport services managers","1226","Production and operations department managers in transport, storage and communic",973,22
"3-55.90","Outros chefes de serviços de transporte marítimo, fluvial e lacustre","Other sea transportation services managers","1226","Production and operations department managers in transport, storage and communic",974,22
"3-6","DESPACHANTES, FISCAIS E COBRADORES DE TRANSPORTES COLETIVOS (EXCETO TREM)","","","",975,
"3-60","Despachantes, fiscais e cobradores de transportes coletivos (exceto trem)","","","",976,
"3-60.25","Despachante de transporte coletivo (exceto trem)","Collective transportation forwarders","5112","Transport conductors",977,260
"3-60.35","Fiscal de transporte coletivo (exceto trem)","Public transportation supervisors","5112","Transport conductors",978,260
"3-60.40","Cobrador de transporte coletivo (exceto trem)","Public transportation collectors","5112","Transport conductors",979,260
"3-60.90","Outros despachantes, fiscais e cobradores de transportes coletivos (exceto trem)","Other supervisors, collectors and forwarders in public transportation","5112","Transport conductors",980,260
"3-7","CLASSIFICADORES DE CORRESPONDÊNCIA, CARTEIROS E MENSAGEIROS","","","",981,
"3-70","Classificadores de correspondência, carteiros e mensageiros","","","",982,
"3-70.20","Classificador de correspondência","Mail classifiers","4142","Mail carriers and sorting clerks",983,240
"3-70.30","Carteiro","Mailers","4142","Mail carriers and sorting clerks",984,240
"3-70.40","Mensageiro","Messengers","9151","Messengers, package and luggage porters and deliverers",985,518
"3-70.90","Outros classificadores de correspondência, carteiros e mensageiros","Other mail classifiers, mailers and messengers","4142","Mail carriers and sorting clerks",986,240
"3-8","TELEFONISTAS, TELEGRAFISTAS E TRABALHADORES ASSEMELHADOS","","","",987,
"3-80","Telefonistas, telegrafistas e trabalhadores assemelhados","","","",988,
"3-80.20","Telefonista","Telephone operators","4223","Telephone switchboard operators",989,255
"3-80.25","Operador de telemarketing","Telemarketing operators","4223","Telephone switchboard operators",990,255
"3-80.30","Radiotelefonista (estação terrestre)","Radio-telephonic operators","4223","Telephone switchboard operators",991,255
"3-80.40","Telegrafista","Telegraphers","4223","Telephone switchboard operators",992,255
"3-80.45","Radiotelegrafista (estação terrestre)","Radio-telegraph operators (ground station)","4223","Telephone switchboard operators",993,255
"3-80.50","Radiotelegrafista (marinha mercante)","Radio-telegraphers (marine)","4223","Telephone switchboard operators",994,255
"3-80.60","Radiotelegrafista (aeronaves)","Radio-telegraphers (aircraft)","4223","Telephone switchboard operators",995,255
"3-80.70","Fonogramista","Phonographers","4223","Telephone switchboard operators",996,255
"3-80.80","Operador de central telegráfica computadorizada","Computerized telegraphic central operators","4223","Telephone switchboard operators",997,255
"3-80.85","Telefonista-monitor","Telephone monitoring workers","4223","Telephone switchboard operators",998,255
"3-80.90","Outros telefonistas, telegrafistas e trabalhadores assemelhados","Other telephones, telegraphic and related workers","4223","Telephone switchboard operators",999,255
"3-9","TRABALHADORES DE SERVIÇOS ADMINISTRATIVOS E TRABALHADORES ASSEMELHADOS NÃO-CLASS","","","",1000,
"3-91","Trabalhadores de serviços de abastecimento e armazenagem","","","",1001,
"3-91.15","Almoxarife","Storeroom keepers","4131","Stock clerks",1002,235
"3-91.20","Operador de recepção, estocagem e movimentação de matéria-prima","Reception, stocking and products movements operators","4133","Transport clerks",1003,237
"3-91.25","Assistente de patrimônio","Asset management assistants","4121","Accounting and bookkeeping clerks",1004,232
"3-91.30","Estoquista","Stock clerks","4131","Stock clerks",1005,235
