cboid,cbodesc,cbotrans,iscoid,iscodesc,cbo_currno,isco_currno
"6-61.40","Patrão de pesca de alto-mar","Deep-sea fishery managers","1311","General managers in agriculture, hunting, forestry and fishing",1432,37
"6-61.90","Outros patrões de pesca","Other fishery managers","1311","General managers in agriculture, hunting, forestry and fishing",1433,37
"6-62","Pescadores industriais","","","",1434,
"6-62.20","Pescador industrial","Industrial fishery workers","6153","Deep-sea fishery workers",1435,312
"6-62.30","Conservador do pescado (embarcações pesqueiras)","Fish maintenance workers (fishery vessels)","6153","Deep-sea fishery workers",1436,312
"6-62.90","Outros pescadores industriais","Other industrial fishery workers","6153","Deep-sea fishery workers",1437,312
"6-63","Pescadores artesanais","","","",1438,
"6-63.20","Pescador artesanal","Artisan fishery workers","6152","Inland and coastal waters fishery workers",1439,311
"6-63.30","Mariscador","Shellfishery workers","6152","Inland and coastal waters fishery workers",1440,311
"6-63.90","Outros pescadores artesanais","Other artisan fishery workers","6151","Aquatic-life cultivation workers",1441,310
"6-64","Trabalhadores da aqüicultura","","","",1442,
"6-64.20","Trabalhador da criação de peixes","Fish breeders","6151","Aquatic-life cultivation workers",1443,310
"6-64.30","Trabalhador da criação de ostras","Oyster breeders","6151","Aquatic-life cultivation workers",1444,310
"6-64.40","Trabalhador da criação de quelônios","Turtle breeders","6151","Aquatic-life cultivation workers",1445,310
"6-64.90","Outros trabalhadores da aqüicultura","Other water related workers","9213","Fishery, hunting and trapping labourers",1446,528
"6-69","Pescadores e trabalhadores assemelhados não-classificados sob outras epígrafes","","","",1447,
"6-69.20","Motorista de pesca","Fishery drivers","9213","Fishery, hunting and trapping labourers",1448,528
"6-69.30","Timoneiro (embarcações pesqueiras)","Fishery vessels conductors","9213","Fishery, hunting and trapping labourers",1449,528
"6-69.90","Outros pescadores e trabalhadores assemelhados não-classificados sob outras epíg","Other fishery and related workers n.e.c.","9213","Fishery, hunting and trapping labourers",1450,528
"6-7","OPERADORES DE MÁQUINAS E IMPLEMENTOS DE AGRICULTURA, PECUÁRIA E EXPLORAÇÃO FLORE","","","",1451,
"6-71","Operadores de máquinas e implementos agrícolas","","","",1452,
"6-71.20","Tratorista agrícola","Tractor drivers","8331","Motorised farm and forestry plant operators",1453,496
"6-71.30","Operador de máquina de beneficiamento de produtos agrícolas","Agricultural improvement machinery operators","8331","Motorised farm and forestry plant operators",1454,496
"6-71.40","Operador de colhedeira","Crop machinery operators","8331","Motorised farm and forestry plant operators",1455,496
"6-71.90","Outros operadores de máquinas e implementos agrícolas","Other machinery and agricultural equipment operators","8331","Motorised farm and forestry plant operators",1456,496
"6-72","Operadores de máquinas e implementos de pecuária","","","",1457,
"6-72.20","Operador de ordenhadeira","Milking machine operators","9211","Farm-hands and labourers",1458,526
"6-72.30","Operador de incubadora","Incubator operators","9211","Farm-hands and labourers",1459,526
"6-72.90","Outros operadores de máquinas e implementos de pecuária","Other machine and agricultural equipment operators","9211","Farm-hands and labourers",1460,526
"6-73","Operadores de máquinas e implementos de exploração florestal","","","",1461,
"6-73.20","Tratorista florestal","Forestry tractor drivers","8331","Motorised farm and forestry plant operators",1462,496
"6-73.30","Operador de serras (exploração florestal)","Saw operators","8331","Motorised farm and forestry plant operators",1463,496
"6-73.90","Outros operadores de máquinas e implementos de exploração florestal","Other machine and forestry extraction equipment operators","8331","Motorised farm and forestry plant operators",1464,496
"7-0","MESTRES, CONTRAMESTRES, SUPERVISORES DE PRODUÇÃO E MANUTENÇÃO INDUSTRIAL E TRABA","","","",1465,
"7-01","Mestres, contramestres, supervisores de empresas manufatureiras e de construção ","","","",1466,
"7-01.15","Mestre (metalurgia e siderurgia)","Supervisors (metallurgic and steel industry)","1229","Production and operations department managers not elsewhere classified",1467,25
"7-01.20","Mestre (indústria química e farmacêutica)","Supervisors (chemical industry and pharmacy)","1229","Production and operations department managers not elsewhere classified",1468,25
"7-01.25","Mestre (indústria petroquímica e carboquímica)","Supervisors (petroleum and carbon industry)","1229","Production and operations department managers not elsewhere classified",1469,25
"7-01.30","Mestre (indústria de borracha e plástico)","Supervisors (rubber and plastic (industries)","1229","Production and operations department managers not elsewhere classified",1470,25
"7-01.35","Mestre (indústria de minerais não-metálicos, exceto os derivados de petróleo e c","Supervisors (non-metallic minerals, except petroleum and charcoal)","1229","Production and operations department managers not elsewhere classified",1471,25
"7-01.40","Mestre (indústria de máquinas e outros equipamentos mecânicos)","Supervisors (machinery and other mechanical equipment)","1229","Production and operations department managers not elsewhere classified",1472,25
"7-01.45","Mestre (indústria de automotores e material de transporte)","Supervisors (automobile and transportation material industries)","1226","Production and operations department managers in transport, storage and communic",1473,22
"7-01.50","Mestre (indústria de material elétrico e eletrônico)","Supervisors (electrical and electronic materials industries)","1229","Production and operations department managers not elsewhere classified",1474,25
"7-01.55","Mestre (indústria de celulose, papel e papelão)","Supervisors (cellulose and paper industries)","1229","Production and operations department managers not elsewhere classified",1475,25
"7-01.60","Mestre (indústria de produtos alimentícios, bebidas e fumo)","Supervisors (food, beverage and tobacco)","1229","Production and operations department managers not elsewhere classified",1476,25
"7-01.65","Mestre (indústria têxtil e de confecções)","Supervisors (textile and clothes industries)","1222","Production and operations department managers in manufacturing",1477,18
"7-01.70","Mestre (indústria de calçados e artefatos de couro)","Supervisors (shoes and leather devices industries)","1222","Production and operations department managers in manufacturing",1478,18
"7-01.75","Mestre (indústria de madeira e mobiliário)","Supervisors (wood and furnishings industries)","1229","Production and operations department managers not elsewhere classified",1479,25
"7-01.77","Mestre (indústria editorial e gráfica)","Supervisors (editorial and graphics industries)","1226","Production and operations department managers in transport, storage and communic",1480,22
"7-01.80","Mestre (construção naval)","Supervisors (navy construction)","1223","Production and operations department managers in construction",1481,19
"7-01.83","Mestre (construção civil)","Supervisors (civil construction)","1223","Production and operations department managers in construction",1482,19
"7-01.84","Supervisor de usina de concreto","Concrete plant supervisors","1229","Production and operations department managers not elsewhere classified",1483,25
"7-01.85","Mestre de linha (ferrovias)","Railroad supervisors","1226","Production and operations department managers in transport, storage and communic",1484,22
"7-01.86","Fiscal de pátio de usina de concreto","Concrete plant courtyard supervisors","1229","Production and operations department managers not elsewhere classified",1485,25
"7-01.87","Inspetor de terraplenagem","Earthwork supervisors","1229","Production and operations department managers not elsewhere classified",1486,25
"7-01.90","Outros mestres, contramestres, supervisores de empresas manufatureiras e trabalh","Other supervisors and masters of manufacturing enterprises and related workers","1222","Production and operations department managers in manufacturing",1487,18
"7-02","Mestres (empresas de extração mineral)","","","",1488,
"7-02.20","Mestre (minas e pedreiras)","Supervisors (mining and quarry)","1229","Production and operations department managers not elsewhere classified",1489,25
"7-02.30","Mestre (poços de petróleo e gás)","Supervisors (petroleum and gas)","1229","Production and operations department managers not elsewhere classified",1490,25
"7-02.90","Outros mestres (empresas de extração mineral)","Other supervisors (mineral extraction enterprises)","1229","Production and operations department managers not elsewhere classified",1491,25
"7-03","Mestres (empresas de energia elétrica, gás, água e esgoto)","","","",1492,
"7-03.20","Mestre (produção de energia elétrica, gás e captação de água)","Supervisors (electrical energy, gas and water production)","1229","Production and operations department managers not elsewhere classified",1493,25
"7-03.30","Mestre (distribuição de energia elétrica, gás e água)","Supervisors (electrical energy, gas and water distribution)","1229","Production and operations department managers not elsewhere classified",1494,25
"7-03.40","Mestre (serviço de esgotos sanitários)","Supervisors (sanitation drain services)","1228","Production and operations department managers in personal care, cleaning and rel",1495,24
"7-03.90","Outros mestres (empresas de energia elétrica, gás, água e esgotos)","Other supervisors (electrical energy, gas, water and drainage)","1229","Production and operations department managers not elsewhere classified",1496,25
"7-04","Contramestres da indústria têxtil","","","",1497,
"7-04.20","Contramestre de fiação (indústria têxtil)","Foremen","3439","Administrative associate professionals not elsewhere classified",1498,204
"7-04.30","Contramestre de tecelagem (indústria têxtil)","Weaving mill foremen (textile industry)","3439","Administrative associate professionals not elsewhere classified",1499,204
"7-04.40","Contramestre de malharia (indústria têxtil)","Mill foremen (textile industry)","3439","Administrative associate professionals not elsewhere classified",1500,204
"7-04.50","Contramestre de acabamento (indústria têxtil)","Finish foremen (textile industry)","3439","Administrative associate professionals not elsewhere classified",1501,204
"7-04.90","Outros contramestres da indústria têxtil","Other textile industries foremen","3439","Administrative associate professionals not elsewhere classified",1502,204
"7-05","Mestres, contramestres, supervisores e operadores de manutenção de sistemas oper","","","",1503,
"7-05.20","Encarregado de manutenção mecânica de sistemas operacionais","Operational systems mechanical maintenance workers","3439","Administrative associate professionals not elsewhere classified",1504,204
"7-05.30","Encarregado de manutenção elétrica de sistemas operacionais","Operational systems electrical maintenance workers","3439","Administrative associate professionals not elsewhere classified",1505,204
"7-05.40","Encarregado de manutenção de instrumentos de controle, medição e similares","Control, measurement and similar equipment maintenance workers","3439","Administrative associate professionals not elsewhere classified",1506,204
"7-05.50","Operador de sala de controle","Control room operators","3439","Administrative associate professionals not elsewhere classified",1507,204
"7-05.90","Outros mestres, contramestres, supervisores e operadores de manutenção de sistem","Other foremen and supervisors of system operations and related workers","3439","Administrative associate professionals not elsewhere classified",1508,204
"7-1","TRABALHADORES DE MINAS E PEDREIRAS, SONDADORES E TRABALHADORES ASSEMELHADOS","","","",1509,
"7-11","Mineiros e canteiros","","","",1510,
"7-11.05","Mineiro, em geral","Mining workers","8111","Mining-plant operators",1511,411
"7-11.10","Canteiro, em geral","Stonemasons","8112","Mineral-ore- and stone-processing-plant operators",1512,412
"7-11.50","Detonador","Blasters","7112","Shotfirers and blasters",1513,321
"7-11.60","Escorador de minas","Abutment and support workers (deep-pit mining)","8111","Mining-plant operators",1514,411
"7-11.70","Amostrador de minérios","Mineral graders","8112","Mineral-ore- and stone-processing-plant operators",1515,412
"7-11.90","Outros mineiros e canteiros","Other mining and stonemasonry workers","8111","Mining-plant operators",1516,411
"7-12","Operadores de máquinas de extração de minérios (minas e pedreiras)","","","",1517,
"7-12.20","Operador de máquina cortadora (minas e pedreiras)","Cutting machinery operators (mining and quarrying)","7113","Stone splitters, cutters and carvers",1518,322
"7-12.30","Operador de máquina perfuradora (minas e pedreiras)","Mineral drill operators","7113","Stone splitters, cutters and carvers",1519,322
"7-12.40","Operador de máquina de extração contínua (minas de carvão)","Extraction equipment operators (charcoal mining)","8112","Mineral-ore- and stone-processing-plant operators",1520,412
"7-12.50","Operador de bob-cat","Bob-cat operators","8112","Mineral-ore- and stone-processing-plant operators",1521,412
"7-12.60","Operador de schutthecar","Schutthecar operators","8112","Mineral-ore- and stone-processing-plant operators",1522,412
"7-12.90","Outros operadores de máquinas de extração de minérios (minas e pedreiras)","Other ore extraction equipment operators","8112","Mineral-ore- and stone-processing-plant operators",1523,412
"7-13","Trabalhadores de beneficiamento de minérios e pedras","","","",1524,
"7-13.20","Destroçador de pedras","Stone processing equipment operators","8112","Mineral-ore- and stone-processing-plant operators",1525,412
"7-13.30","Moleiro de minérios","Ore processing equipment operators","8112","Mineral-ore- and stone-processing-plant operators",1526,412
"7-13.35","Triturador de pedras","Stone grinders","8112","Mineral-ore- and stone-processing-plant operators",1527,412
"7-13.40","Operador de britador de mandíbulas","Stone and ore processing equipment operators","8112","Mineral-ore- and stone-processing-plant operators",1528,412
"7-13.50","Operador de peneiras hidráulicas","Stone and ore processing equipment operators","8112","Mineral-ore- and stone-processing-plant operators",1529,412
"7-13.60","Operador de aparelho de flutuação","Stone and ore processing equipment operators","8112","Mineral-ore- and stone-processing-plant operators",1530,412
"7-13.70","Operador de aparelho de precipitação (minas de ouro ou prata)","Precipitation processing equipment operators (gold and silver mining)","8111","Mining-plant operators",1531,411
"7-13.80","Operador de jig (minas)","Jig operators (mines)","8111","Mining-plant operators",1532,411
"7-13.90","Outros trabalhadores de beneficiamento de minérios e pedras","Other stone and ore processing equipment operators","8112","Mineral-ore- and stone-processing-plant operators",1533,412
"7-14","Sondadores de poços de petróleo e gás e trabalhadores assemelhados","","","",1534,
"7-14.20","Sondador (poços de petróleo e gás)","Drillers (petroleum and gas)","8113","Well drillers and borers and related workers",1535,413
"7-14.30","Plataformista (petróleo)","Oil rig operators","8155","Petroleum- and natural-gas-refining-plant operators",1536,431
"7-14.40","Torrista (petróleo)","Petroleum tower operators","8155","Petroleum- and natural-gas-refining-plant operators",1537,431
"7-14.50","Cimentador (poços de petróleo e gás)","Concrete construction workers (petroleum and gas)","8155","Petroleum- and natural-gas-refining-plant operators",1538,431
"7-14.60","Desencrustador (poços de petróleo e gás)","Petroleum and gas workers","8113","Well drillers and borers and related workers",1539,413
"7-14.90","Outros sondadores de poços de petróleo e gás","Other petroleum and gas drillers","8113","Well drillers and borers and related workers",1540,413
"7-15","Sondadores de poços (exceto de petróleo e gás)","","","",1541,
"7-15.20","Sondador de poços (exceto de petróleo e gás)","Well drillers (except petroleum and gas)","8113","Well drillers and borers and related workers",1542,413
"7-15.25","Operador de sonda rotativa","Rotating drill operators","8113","Well drillers and borers and related workers",1543,413
"7-15.27","Operador de sonda de percussão","Percussion drill operators","8113","Well drillers and borers and related workers",1544,413
"7-15.90","Outros sondadores de poços (exceto de petróleo e gás)","Other well drill operators (except petroleum and gas)","8113","Well drillers and borers and related workers",1545,413
"7-16","Salineiros (sal marinho)","","","",1546,
"7-16.20","Salineiro (sal marinho)","Salt bed workers (sea salt)","8290","Other machine operators and assemblers",1547,485
"7-16.90","Outros salineiros (sal marinho)","Other salt bed workers (sea salt)","8290","Other machine operators and assemblers",1548,485
"7-19","Trabalhadores de minas e pedreiras, sondadores e trabalhadores assemelhados não-","","","",1549,
"7-19.20","Garimpeiro","Gold washers","7111","Miners and quarry workers",1550,320
"7-19.30","Sondador (xisto)","Drillers (mineral coal)","8113","Well drillers and borers and related workers",1551,413
"7-19.90","Outros trabalhadores de minas e pedreiras, sondadores e trabalhadores assemelhad","Other mining and stonemason, drillers and related workers n.e.c.","9311","Mining and quarrying labourers",1552,531
"7-2","TRABALHADORES METALÚRGICOS E SIDERÚRGICOS","","","",1553,
"7-20","Operadores de aciaria","","","",1554,
"7-20.15","Operador de recebimento de gusa","Iron-foundry withdrawel operators","8121","Ore and metal furnace operators",1555,415
"7-20.20","Operador de misturador de gusa","Iron-foundry mixing operators","8121","Ore and metal furnace operators",1556,415
"7-20.23","Operador de dessulfurador de gusa","Iron-foundry desulphurization equipment operators","8121","Ore and metal furnace operators",1557,415
"7-20.25","Operador de basculamento de convertedor","Converter equipment operators","8121","Ore and metal furnace operators",1558,415
"7-20.30","Operador de forno-panela","Furnace operators","8121","Ore and metal furnace operators",1559,415
"7-20.35","Soprador de convertedor","Converter blowers","8121","Ore and metal furnace operators",1560,415
"7-20.90","Outros trabalhadores de aciaria","Other steel mill workers","8121","Ore and metal furnace operators",1561,415
"7-21","Forneiros e operadores metalúrgicos (primeira fusão)","","","",1562,
"7-21.13","Operador de área de corrida","Furnace supply workers","8121","Ore and metal furnace operators",1563,415
"7-21.20","Forneiro (alto forno)","Furnace operators (high furnace)","8121","Ore and metal furnace operators",1564,415
"7-21.30","Forneiro (conversor siemens-martin)","Furnace operators (Siemens-Martin converter)","8121","Ore and metal furnace operators",1565,415
"7-21.40","Forneiro (conversor a oxigênio)","Furnace operators (oxygen converter)","8121","Ore and metal furnace operators",1566,415
"7-21.50","Forneiro (conversor bessemer)","Furnace operators (Bessemer converter)","8121","Ore and metal furnace operators",1567,415
"7-21.60","Forneiro (forno elétrico)","Furnace operators (electrical furnace)","8121","Ore and metal furnace operators",1568,415
"7-21.70","Forneiro (refino de metais não-ferrosos)","Furnace operators (non-iron metal refine)","8121","Ore and metal furnace operators",1569,415
"7-21.80","Forneiro de forno de redução direta","Direct reduction furnace operators","8121","Ore and metal furnace operators",1570,415
"7-21.90","Outros forneiros e operadores metalúrgicos (primeira fusão)","Other furnace operators and metallurgy workers (first fusion)","8121","Ore and metal furnace operators",1571,415
"7-22","Operadores de laminação","","","",1572,
"7-22.10","Operador de laminador, em geral","Laminate operators, general","8122","Metal melters, casters and rolling-mill operators",1573,416
"7-22.15","Operador de laminador desbastador","Laminate operators","8122","Metal melters, casters and rolling-mill operators",1574,416
"7-22.20","Operador de laminador de barras a quente","Hot-bars laminate operators","8122","Metal melters, casters and rolling-mill operators",1575,416
"7-22.40","Operador de laminador de barras a frio","Cold-bars laminate operators","8122","Metal melters, casters and rolling-mill operators",1576,416
"7-22.50","Operador de laminador de metais não-ferrosos","Non-iron metals laminate operators","8122","Metal melters, casters and rolling-mill operators",1577,416
"7-22.60","Operador de laminador de tubos","Pipe laminate operators","8122","Metal melters, casters and rolling-mill operators",1578,416
"7-22.80","Operador de montagem de cilindros e mancais","Cylinder assembly machine operators","8122","Metal melters, casters and rolling-mill operators",1579,416
"7-22.85","Recuperador de guias e cilindros","Cylinder recuperation machine operators","8122","Metal melters, casters and rolling-mill operators",1580,416
"7-22.90","Outros operadores de laminação","Other laminate operators","8122","Metal melters, casters and rolling-mill operators",1581,416
"7-23","Forneiros metalúrgicos (segunda fusão e reaquecimento)","","","",1582,
"7-23.15","Forneiro de revérbero","Repel furnace operators","8121","Ore and metal furnace operators",1583,415
"7-23.17","Forneiro de fundição (forno de redução)","Fusing furnace operators (reduction furnace)","8121","Ore and metal furnace operators",1584,415
"7-23.25","Forneiro de forno-poço","Well furnace operators","8121","Ore and metal furnace operators",1585,415
"7-23.30","Forneiro de cubilô","Furnace operators","8121","Ore and metal furnace operators",1586,415
"7-23.35","Forneiro de cadinho","Furnace operators","8121","Ore and metal furnace operators",1587,415
"7-23.40","Forneiro de reaquecimento e tratamento térmico","Thermal treatment and heating furnace operators","8121","Ore and metal furnace operators",1588,415
"7-23.45","Forneiro de forjaria","Forgers","8121","Ore and metal furnace operators",1589,415
"7-23.90","Outros forneiros metalúrgicos (segunda fusão e reaquecimento)","Other metallurgical furnace operators","8121","Ore and metal furnace operators",1590,415
"7-24","Fundidores de metais","","","",1591,
"7-24.20","Fundidor de metais","Metal melters operators","8122","Metal melters, casters and rolling-mill operators",1592,416
"7-24.30","Operador de máquina centrifugadora de fundição","Melting centrifuge operators","8122","Metal melters, casters and rolling-mill operators",1593,416
"7-24.40","Operador de máquina de fundir sob pressão","Melting equipment operators (under pressure)","8122","Metal melters, casters and rolling-mill operators",1594,416
"7-24.60","Lingotador","Ingot machine operators","8122","Metal melters, casters and rolling-mill operators",1595,416
"7-24.70","Operador de acabamento de peças fundidas","Melters and parts processing equipment operators","8122","Metal melters, casters and rolling-mill operators",1596,416
"7-24.75","Preparador de panelas (lingotamento)","Pan preparers","8122","Metal melters, casters and rolling-mill operators",1597,416
"7-24.80","Operador de vazamento (lingotamento)","Leak operators (ingots)","8122","Metal melters, casters and rolling-mill operators",1598,416
"7-24.90","Outros fundidores de metais","Other metal melters","8122","Metal melters, casters and rolling-mill operators",1599,416
"7-25","Moldadores e macheiros","","","",1600,
"7-25.15","Operador de equipamento de preparação de areia","Sand preparation equipment operators","7211","Metal moulders and coremakers",1601,343
"7-25.20","Moldador, à mão","Molders, manual","7211","Metal moulders and coremakers",1602,343
"7-25.40","Moldador, à máquina","Molders, machine-operating","7211","Metal moulders and coremakers",1603,343
"7-25.50","Macheiro, à mão","Manual coremakers","7211","Metal moulders and coremakers",1604,343
"7-25.60","Macheiro, à máquina","Mechanical coremakers","7211","Metal moulders and coremakers",1605,343
"7-25.90","Outros moldadores e macheiros","Other molders","7211","Metal moulders and coremakers",1606,343
"7-26","Trabalhadores de tratamento térmico e termoquímico de metais","","","",1607,
"7-26.20","Operador de forno de tratamento térmico","Thermal-treatment furnace operators","8123","Metal-heat-treating-plant operators",1608,417
"7-26.30","Temperador de metais","Metal-hardening workers","8123","Metal-heat-treating-plant operators",1609,417
"7-26.40","Cementador de metais","Metal cement equipment operators","8123","Metal-heat-treating-plant operators",1610,417
"7-26.50","Normalizador de metais","Metal normalizers","8123","Metal-heat-treating-plant operators",1611,417
"7-26.60","Operador de equipamento para resfriamento","Cooling equipment operators","8123","Metal-heat-treating-plant operators",1612,417
"7-26.70","Recuperador de chapas","Plate recuperation workers","8123","Metal-heat-treating-plant operators",1613,417
"7-26.90","Outros trabalhadores de tratamento térmico e termoquímico de metais","Other thermal and chemical treatment workers","8123","Metal-heat-treating-plant operators",1614,417
"7-27","Trefiladores e estiradores de metais","","","",1615,
"7-27.20","Trefilador de metais, à mão","Wire drawers, manual","8124","Metal drawers and extruders",1616,418
"7-27.30","Trefilador de metais, à máquina","Wire drawers, machine-operating","8124","Metal drawers and extruders",1617,418
