CODIGO;TITULO
951;ELETRICISTAS ELETRÔNICOS DE MANUTENÇÃO INDUSTRIAL, COMERCIAL E RESIDENCIAL                                                        
953;ELETRICISTAS ELETRÔNICOS DE MANUTENÇÃO VEICULAR                                                                                   
954;MANTENEDORES ELETROMECÂNICOS                                                                                                      
991;OUTROS TRABALHADORES DA CONSERVAÇÃO E MANUTENÇÃO (EXCETO TRABALHADORES ELEMENTARES)                                               
992;TRABALHADORES ELEMENTARES DA MANUTENÇÃO                                                                                           
